{
  "$schema": "https://json-schema.org/draft/2020-12/schema",
  "additionalProperties": false,
  "properties": {
    "countryCode": {
      "pattern": "^[A-Z]{2}$",
      "type": "string"
    },
    "description": {
      "maxLength": 600,
      "minLength": 20,
      "type": "string"
    },
    "name": {
      "minLength": 2,
      "type": "string"
    },
    "slug": {
      "minLength": 2,
      "pattern": "^[a-z0-9]+(-[a-z0-9]+)*$",
      "type": "string"
    },
    "status": {
      "enum": [
        "active",
        "inactive"
      ],
      "type": "string"
    },
    "updatedAt": {
      "format": "date-time",
      "pattern": "^(?:(?:\\d\\d[2468][048]|\\d\\d[13579][26]|\\d\\d0[48]|[02468][048]00|[13579][26]00)-02-29|\\d{4}-(?:(?:0[13578]|1[02])-(?:0[1-9]|[12]\\d|3[01])|(?:0[469]|11)-(?:0[1-9]|[12]\\d|30)|(?:02)-(?:0[1-9]|1\\d|2[0-8])))T(?:(?:[01]\\d|2[0-3]):[0-5]\\d:[0-5]\\d(?:\\.\\d+)?(?:Z|([+-](?:[01]\\d|2[0-3]):[0-5]\\d)))$",
      "type": "string"
    },
    "url": {
      "format": "uri",
      "type": "string"
    }
  },
  "required": [
    "slug",
    "name",
    "url",
    "countryCode",
    "description",
    "status",
    "updatedAt"
  ],
  "title": "vendor",
  "type": "object"
}
