{
  "slug": "drop",
  "name": "Drop",
  "url": "https://drop.com",
  "countryCode": "US",
  "description": "US storefront and platform for community-driven keyboard, audio, and gaming products. Co-develops MT3 keycap profiles with Matt3o and runs in-house Drop-branded switches and boards.",
  "status": "active",
  "updatedAt": "2026-05-09T20:00:00.000Z"
}
