{
  "slug": "wuque-studio",
  "name": "Wuque Studio",
  "url": "https://shop.wuquestudio.com",
  "countryCode": "CN",
  "description": "China-based design studio and vendor known for in-house boards (Mammoth, Ikki68, Promise) and partnered group buys, sold direct from shop.wuquestudio.com with regional proxies.",
  "status": "active",
  "updatedAt": "2026-05-09T20:00:00.000Z"
}
