{
  "slug": "kbdfans",
  "name": "KBDfans",
  "url": "https://kbdfans.com",
  "countryCode": "CN",
  "description": "China-based mechanical keyboard vendor with a long-running storefront for boards, switches, keycaps, and accessories; hosts a large slate of GMK and in-house group buys with multi-region proxies.",
  "status": "active",
  "updatedAt": "2026-05-09T20:00:00.000Z"
}
