{
  "slug": "qwertykeys",
  "name": "Qwertykeys",
  "url": "https://www.qwertykeys.com",
  "countryCode": "CN",
  "description": "China-based custom mechanical keyboard manufacturer and direct-to-consumer storefront, based in Guangdong. Best known for the QK65/QK75/QK80/QK100 board line; ships direct with wireless and hot-swap PCB options as standard configurator choices rather than group-buy upsell tiers.",
  "status": "active",
  "updatedAt": "2026-07-14T00:00:00.000Z"
}
