{
  "slug": "divinikey",
  "name": "Divinikey",
  "url": "https://divinikey.com",
  "countryCode": "US",
  "description": "US-based mechanical keyboard retailer headquartered in Los Angeles, California, stocking keyboards, keycap sets, switches, and accessories; runs group buys for custom keyboard projects including DCS and GMK keycap sets.",
  "status": "active",
  "updatedAt": "2026-06-01T00:00:00.000Z"
}
